{
    "session_id": "sess_demo_003",
    "capability": "cap_demo_token_example_replace_with_real_format",
    "model": "llama3.1",
    "messages": [
        {
            "role": "user",
            "content": "Tell me a fun fact."
        }
    ],
    "timeout_ms": 2000,
    "client_request_id": "ui-0003"
}